{
  "unique_id": "alpaca_2687276137441196591",
  "technique_name": "What is the environment like in a collaborative workplace?",
  "description": "In a collaborative workplace, the environment is typically characterized by open communication, transparency, and mutual respect. Team members are encouraged to share ideas and knowledge with each other, collaborate to develop solutions, and work together to reach common goals. The focus of the workplace is on collective problem-solving and creating an atmosphere of trust, acceptance and mutual support.",
  "example": "",
  "source_url": "https://github.com/tatsu-lab/stanford_alpaca",
  "source_name": "Stanford Alpaca",
  "source_type": "github",
  "category": "instruction_tuning",
  "schema_version": "1.0",
  "retrieval_timestamp": "2026-06-14T13:52:16Z",
  "last_updated": "2026-06-14T13:52:16Z",
  "raw_payload": {}
}