{
  "unique_id": "alpaca_8492603492696483875",
  "technique_name": "How can someone reduce their risk of getting cancer?",
  "description": "There are many things one can do to reduce their risk of getting cancer. Some of these include maintaining a healthy diet, avoiding smoking and excess alcohol consumption, exercising regularly, avoiding overexposure to sunlight, and staying up to date with regular medical check-ups. Additionally, eating foods high in antioxidants like fruits, vegetables, and nuts can further reduce the risk.",
  "example": "",
  "source_url": "https://github.com/tatsu-lab/stanford_alpaca",
  "source_name": "Stanford Alpaca",
  "source_type": "github",
  "category": "instruction_tuning",
  "schema_version": "1.0",
  "retrieval_timestamp": "2026-06-14T13:52:16Z",
  "last_updated": "2026-06-14T13:52:16Z",
  "raw_payload": {}
}