{
  "unique_id": "alpaca_-4199854681133431965",
  "technique_name": "Suggest a 3-step routine to help people stay healthy.",
  "description": "1. Eat a balanced, nutritious diet that includes fruits, vegetables, whole grains, and lean proteins.\n2. Exercise at least 30 minutes per day.\n3. Get adequate sleep and rest, aiming for 7-9 hours of sleep each night.",
  "example": "",
  "source_url": "https://github.com/tatsu-lab/stanford_alpaca",
  "source_name": "Stanford Alpaca",
  "source_type": "github",
  "category": "instruction_tuning",
  "schema_version": "1.0",
  "retrieval_timestamp": "2026-06-14T13:52:16Z",
  "last_updated": "2026-06-14T13:52:16Z",
  "raw_payload": {}
}