{
  "unique_id": "alpaca_-1777463444272792915",
  "technique_name": "Given a sentence, you should provide its synonyms",
  "description": "The greatest challenge is discovering solutions.",
  "example": "The biggest challenge is finding solutions.",
  "source_url": "https://github.com/tatsu-lab/stanford_alpaca",
  "source_name": "Stanford Alpaca",
  "source_type": "github",
  "category": "instruction_tuning",
  "schema_version": "1.0",
  "retrieval_timestamp": "2026-06-14T13:52:16Z",
  "last_updated": "2026-06-14T13:52:16Z",
  "raw_payload": {}
}