{
  "unique_id": "alpaca_-7450721864538187925",
  "technique_name": "Identify and explain the components of a modern operating system.",
  "description": "A modern operating system typically consists of several components, including a kernel, a user interface, file system, device drivers, and system libraries. The kernel is the core of the operating system and handles the memory, process and task management, and the communication between hardware and software components. The user interface provides the means for users to interact with the operating system, such as via a graphical user interface (GUI). The file system organizes and stores data, all",
  "example": "",
  "source_url": "https://github.com/tatsu-lab/stanford_alpaca",
  "source_name": "Stanford Alpaca",
  "source_type": "github",
  "category": "instruction_tuning",
  "schema_version": "1.0",
  "retrieval_timestamp": "2026-06-14T13:52:16Z",
  "last_updated": "2026-06-14T13:52:16Z",
  "raw_payload": {}
}