{
  "unique_id": "alpaca_-1874812676435681237",
  "technique_name": "Edit this sentence so that it uses correct grammar and punctuation.",
  "description": "He's a stubborn boy.",
  "example": "he's a stubborn boy",
  "source_url": "https://github.com/tatsu-lab/stanford_alpaca",
  "source_name": "Stanford Alpaca",
  "source_type": "github",
  "category": "instruction_tuning",
  "schema_version": "1.0",
  "retrieval_timestamp": "2026-06-14T13:52:16Z",
  "last_updated": "2026-06-14T13:52:16Z",
  "raw_payload": {}
}