{
  "unique_id": "alpaca_-3668200740804709933",
  "technique_name": "Write a blog post on how to become a successful entrepreneur.",
  "description": "For many of us, becoming an entrepreneur means following our dreams and starting our own business. Being an entrepreneur can be a rewarding and fulfilling experience, but it does come with its own unique set of challenges. Here are some do’s and don’ts for becoming a successful entrepreneur:\n\nDo:\n● Have a plan: Having a plan and direction to work towards is key. Make sure to research the industry, create an effective business plan, and understand possible risks and rewards.\n● Get help: When star",
  "example": "",
  "source_url": "https://github.com/tatsu-lab/stanford_alpaca",
  "source_name": "Stanford Alpaca",
  "source_type": "github",
  "category": "instruction_tuning",
  "schema_version": "1.0",
  "retrieval_timestamp": "2026-06-14T13:52:16Z",
  "last_updated": "2026-06-14T13:52:16Z",
  "raw_payload": {}
}