{
  "unique_id": "alpaca_8430508282966797037",
  "technique_name": "Analyze the literary devices used in this excerpt",
  "description": "The literary devices used in this excerpt include imagery to convey the atmosphere of loneliness and sadness, personification to give human characteristics to the rain, and repetition of the sound \"sss\" in the words \"solitary\" and \"cloaked\" to emphasize the sense of loneliness and sadness.",
  "example": "He was alone in the rain, a solitary figure cloaked in a deep, dark sadness.",
  "source_url": "https://github.com/tatsu-lab/stanford_alpaca",
  "source_name": "Stanford Alpaca",
  "source_type": "github",
  "category": "instruction_tuning",
  "schema_version": "1.0",
  "retrieval_timestamp": "2026-06-14T13:52:16Z",
  "last_updated": "2026-06-14T13:52:16Z",
  "raw_payload": {}
}