{
  "unique_id": "alpaca_-8631303917748511241",
  "technique_name": "Summarize the main points of a news article about the 2020 US election in 200 words.",
  "description": "The 2020 US Presidential election was one of the most consequential election cycles in recent memory. Though the election was largely considered a referendum on the Presidency of Donald Trump, it was also notable for its implications for the future of the United States: an election that could determine the future of healthcare, immigration, climate change, and the rights of many communities.\n\nEarly polls had Joe Biden and Donald Trump in a virtual tie, yet on election night Biden had a substanti",
  "example": "",
  "source_url": "https://github.com/tatsu-lab/stanford_alpaca",
  "source_name": "Stanford Alpaca",
  "source_type": "github",
  "category": "instruction_tuning",
  "schema_version": "1.0",
  "retrieval_timestamp": "2026-06-14T13:52:16Z",
  "last_updated": "2026-06-14T13:52:16Z",
  "raw_payload": {}
}