{
  "unique_id": "alpaca_7301035986001775793",
  "technique_name": "Write a sentence explaining how eating healthy benefits the human body?",
  "description": "Eating a balanced and healthy diet helps to provide essential nutrients to the human body to help keep it functioning properly and prevent long-term health issues.",
  "example": "",
  "source_url": "https://github.com/tatsu-lab/stanford_alpaca",
  "source_name": "Stanford Alpaca",
  "source_type": "github",
  "category": "instruction_tuning",
  "schema_version": "1.0",
  "retrieval_timestamp": "2026-06-14T13:52:16Z",
  "last_updated": "2026-06-14T13:52:16Z",
  "raw_payload": {}
}