{
  "unique_id": "alpaca_-789542085178192059",
  "technique_name": "Compose a tweet to increase brand awareness.",
  "description": "Get ready for an amazing experience with our brand new products! #[BrandName] #NewProductLaunch #ExperienceTheDifference",
  "example": "",
  "source_url": "https://github.com/tatsu-lab/stanford_alpaca",
  "source_name": "Stanford Alpaca",
  "source_type": "github",
  "category": "instruction_tuning",
  "schema_version": "1.0",
  "retrieval_timestamp": "2026-06-14T13:52:16Z",
  "last_updated": "2026-06-14T13:52:16Z",
  "raw_payload": {}
}