{
  "unique_id": "alpaca_-1100464008822904801",
  "technique_name": "Can you name five plants that live in the desert?",
  "description": "Five common plants that grow in the desert are cacti, creosote, Joshua trees, mesquite, and yucca. Cacti have adapted to many desert environments and can be found in almost all of them. Creosote is a small shrub that is very hardy and can thrive in arid climates. Joshua trees are native to the southwestern United States and thrive in desert environments. Mesquite is also a small shrub that grows in dry areas and relies on a deep root system to survive. Finally, yucca is a larger flowering shrub ",
  "example": "",
  "source_url": "https://github.com/tatsu-lab/stanford_alpaca",
  "source_name": "Stanford Alpaca",
  "source_type": "github",
  "category": "instruction_tuning",
  "schema_version": "1.0",
  "retrieval_timestamp": "2026-06-14T13:52:16Z",
  "last_updated": "2026-06-14T13:52:16Z",
  "raw_payload": {}
}