{
  "unique_id": "alpaca_1395162665344113974",
  "technique_name": "Given a set of points, calculate the area of the shape created.",
  "description": "The area of the shape formed by the given points is 7.",
  "example": "(1, 2) (2, 3) (3, 2) (4, 5)",
  "source_url": "https://github.com/tatsu-lab/stanford_alpaca",
  "source_name": "Stanford Alpaca",
  "source_type": "github",
  "category": "instruction_tuning",
  "schema_version": "1.0",
  "retrieval_timestamp": "2026-06-14T13:52:16Z",
  "last_updated": "2026-06-14T13:52:16Z",
  "raw_payload": {}
}