{
  "unique_id": "alpaca_-7747822282243666234",
  "technique_name": "Explain the concept of a bubble sort algorithm to a non-technical audience.",
  "description": "A bubble sort algorithm is a type of sorting algorithm that is used to sort elements in an array. It works by looking at each element of the array and comparing it to the next element. If the first element is bigger than the second element, they are swapped. This process is repeated until the whole array is sorted. This type of sorting is one of the simplest sorting algorithms, but it can be slow if the array has many elements.",
  "example": "",
  "source_url": "https://github.com/tatsu-lab/stanford_alpaca",
  "source_name": "Stanford Alpaca",
  "source_type": "github",
  "category": "instruction_tuning",
  "schema_version": "1.0",
  "retrieval_timestamp": "2026-06-14T13:52:16Z",
  "last_updated": "2026-06-14T13:52:16Z",
  "raw_payload": {}
}