{
  "unique_id": "alpaca_8257233619817309212",
  "technique_name": "Describe the process of selling a house.",
  "description": "The process of selling a house typically involves several steps including setting a listing price, listing the property on the market, staging the property, and hosting open houses and showings. Additionally, negotiations with potential buyers and inspections must be conducted before the contract is finalized and closing documents are signed. During closing, the seller typically pays all closing costs, transfers the title and keys to the buyer, and receives their proceeds from the sale.",
  "example": "",
  "source_url": "https://github.com/tatsu-lab/stanford_alpaca",
  "source_name": "Stanford Alpaca",
  "source_type": "github",
  "category": "instruction_tuning",
  "schema_version": "1.0",
  "retrieval_timestamp": "2026-06-14T13:52:16Z",
  "last_updated": "2026-06-14T13:52:16Z",
  "raw_payload": {}
}