{
  "unique_id": "alpaca_1932714135759716390",
  "technique_name": "Insert a comma to make the following sentence grammatically correct.",
  "description": "The bakery, that I visited yesterday, had freshly made croissants.",
  "example": "The bakery that I visited yesterday had freshly made croissants.",
  "source_url": "https://github.com/tatsu-lab/stanford_alpaca",
  "source_name": "Stanford Alpaca",
  "source_type": "github",
  "category": "instruction_tuning",
  "schema_version": "1.0",
  "retrieval_timestamp": "2026-06-14T13:52:16Z",
  "last_updated": "2026-06-14T13:52:16Z",
  "raw_payload": {}
}