{
  "unique_id": "alpaca_-6914877498519636689",
  "technique_name": "List 3 reasons why social media can be harmful.",
  "description": "1. It can lead to comparison, envy and feelings of inadequacy.\n2. It can lead to an unhealthy obsession with people's lives and give a distorted view of reality. \n3. It can be used to spread false information and dangerous content.",
  "example": "",
  "source_url": "https://github.com/tatsu-lab/stanford_alpaca",
  "source_name": "Stanford Alpaca",
  "source_type": "github",
  "category": "instruction_tuning",
  "schema_version": "1.0",
  "retrieval_timestamp": "2026-06-14T13:52:16Z",
  "last_updated": "2026-06-14T13:52:16Z",
  "raw_payload": {}
}