{
  "unique_id": "alpaca_-4074061480845050841",
  "technique_name": "Generate an environmental message.",
  "description": "We must take action now to reduce our environmental impact and protect our planet for future generations. Every action counts, from conserving energy to reducing waste to planting trees. Let's work together to make a difference for the Earth today.",
  "example": "",
  "source_url": "https://github.com/tatsu-lab/stanford_alpaca",
  "source_name": "Stanford Alpaca",
  "source_type": "github",
  "category": "instruction_tuning",
  "schema_version": "1.0",
  "retrieval_timestamp": "2026-06-14T13:52:16Z",
  "last_updated": "2026-06-14T13:52:16Z",
  "raw_payload": {}
}