{
  "unique_id": "alpaca_6426598391627425786",
  "technique_name": "Identify whether the statement is positive or negative.",
  "description": "negative",
  "example": "This dress is so ugly.",
  "source_url": "https://github.com/tatsu-lab/stanford_alpaca",
  "source_name": "Stanford Alpaca",
  "source_type": "github",
  "category": "instruction_tuning",
  "schema_version": "1.0",
  "retrieval_timestamp": "2026-06-14T13:52:16Z",
  "last_updated": "2026-06-14T13:52:16Z",
  "raw_payload": {}
}