{
  "unique_id": "alpaca_-6727042583015550772",
  "technique_name": "Come up with an analogy to explain the power of AI.",
  "description": "AI is like a strong bridge connecting two distant lands. It can help us make sense of the vast quantities of data available and provide us with the insights necessary to make educated decisions and move forward into the future.",
  "example": "",
  "source_url": "https://github.com/tatsu-lab/stanford_alpaca",
  "source_name": "Stanford Alpaca",
  "source_type": "github",
  "category": "instruction_tuning",
  "schema_version": "1.0",
  "retrieval_timestamp": "2026-06-14T13:52:16Z",
  "last_updated": "2026-06-14T13:52:16Z",
  "raw_payload": {}
}