{
  "unique_id": "alpaca_2060636148789393953",
  "technique_name": "Share a fact about the oldest living tree on Earth.",
  "description": "The oldest living tree on Earth is a Bristlecone Pine tree located in the White Mountains of California and it is estimated to be over 5,000 years old.",
  "example": "",
  "source_url": "https://github.com/tatsu-lab/stanford_alpaca",
  "source_name": "Stanford Alpaca",
  "source_type": "github",
  "category": "instruction_tuning",
  "schema_version": "1.0",
  "retrieval_timestamp": "2026-06-14T13:52:16Z",
  "last_updated": "2026-06-14T13:52:16Z",
  "raw_payload": {}
}